{
  "$schema": "../../../schema/openparkcad-input.schema.json",
  "version": "0.3",
  "name": "representative irregular courtyard pass candidate",
  "units": "m",
  "standards": {
    "jurisdiction": "unspecified",
    "standard_profile": "project-policy-only",
    "strictness": "conservative",
    "notes": "No jurisdictional compliance claim."
  },
  "site": {
    "boundary": {
      "type": "polygon",
      "points": [[0, 0], [76, 0], [76, 22], [70, 22], [70, 50], [50, 50], [50, 58], [0, 58]]
    },
    "obstacles": [
      {
        "id": "utility-building",
        "type": "building",
        "geometry": {
          "type": "polygon",
          "points": [[56, 7], [67, 7], [67, 18], [56, 18]]
        },
        "clearance": 0.6,
        "affects": ["stall", "aisle", "swept_path"],
        "authority": "project_policy",
        "priority": "hard"
      }
    ],
    "reserved_areas": [
      {
        "id": "north-landscape-strip",
        "type": "landscape",
        "geometry": {
          "type": "polygon",
          "points": [[0, 53], [45, 53], [45, 58], [0, 58]]
        },
        "clearance": 0.2,
        "affects": ["stall", "aisle", "swept_path"],
        "authority": "project_policy",
        "priority": "hard"
      }
    ]
  },
  "site_features": [
    {
      "id": "courtyard-column",
      "type": "column",
      "geometry": {"type": "circle", "center": [49, 31], "radius": 0.4},
      "clearance": 0.35,
      "affects": ["vehicle_clearance", "stall_access"],
      "authority": "project_policy",
      "priority": "hard"
    }
  ],
  "entrances": [
    {
      "id": "south-shared-gate",
      "mode": "shared",
      "center": [24, 0],
      "width": 8.0,
      "heading_degrees": 90,
      "allowed_movements": ["enter", "exit"]
    }
  ],
  "pedestrian_and_emergency": {
    "pedestrian_routes": [
      {
        "id": "west-walkway",
        "type": "pedestrian_route",
        "geometry": {
          "type": "polyline_buffer",
          "points": [[3, 1], [3, 51]],
          "width": 1.8
        },
        "affects": ["stall", "swept_path"],
        "authority": "project_policy",
        "priority": "hard"
      }
    ],
    "fire_lanes": [
      {
        "id": "east-fire-edge",
        "type": "fire_lane",
        "geometry": {
          "type": "polyline_buffer",
          "points": [[73.5, 1], [73.5, 20]],
          "width": 4.0
        },
        "affects": ["stall", "aisle", "swept_path"],
        "authority": "project_policy",
        "priority": "hard"
      }
    ],
    "emergency_access_required": true
  },
  "vehicles": {
    "design_vehicle": {
      "id": "passenger-car-medium",
      "length": 4.8,
      "width": 1.9,
      "wheelbase": 2.8,
      "min_turning_radius": 5.5,
      "turning_radius_reference": "outer_front_wheel",
      "track_width": 1.6,
      "front_overhang": 1.0,
      "rear_overhang": 1.0,
      "swept_path_margin": 0.25,
      "max_reverse_distance": 12.0
    }
  },
  "parking": {
    "stall_types": [
      {
        "id": "standard-90",
        "family": "perpendicular",
        "width": 2.6,
        "length": 5.4,
        "allowed_angles": [90],
        "drive_over": false,
        "access_sides": ["front"],
        "enabled": true
      }
    ],
    "quotas": {"accessible_min": 0, "ev_min": 0}
  },
  "aisles": {
    "selection_mode": "fixed",
    "fixed_class": "wide-two-way",
    "classes": [
      {
        "id": "wide-two-way",
        "width": 6.5,
        "capacity": "two_vehicle",
        "directionality": "two_way",
        "centerline_crossing": "allowed",
        "enabled": true
      }
    ]
  },
  "constraints": {
    "authority": "project_policy",
    "setbacks": {"site_boundary": 0.3, "obstacle": 0.4},
    "circulation": {
      "require_all_stalls_reachable": true,
      "require_exit_path": true,
      "allow_dead_end_aisles": false,
      "allow_narrow_two_way": false
    },
    "maneuvering": {
      "require_turning_radius_check": true,
      "require_swept_path_check": true,
      "max_reverse_distance": 12.0
    }
  },
  "optimization": {
    "objective": "conservative",
    "heading_deltas_degrees": [0],
    "entrance_offsets": [0],
    "branch_start_positions": [24, 42],
    "branch_sides": ["left"],
    "max_branches": 1,
    "enable_connectors": false,
    "promote_candidate_layout_preview": false
  },
  "diagnostics": {
    "explain_rejections": true,
    "export_debug_layers": true,
    "include_unsupported_fields": true,
    "report_constraint_status": true
  },
  "metadata": {
    "fixture_provenance": "synthetic_representative_real_site_shaped",
    "coordinate_system": "local metres",
    "notes": "Regression geometry only; not a survey or customer site."
  },
  "regression_expectations": {
    "intended_outcome": "valid_only_when_all_requested_checks_are_active",
    "boundary_non_rectangular": true,
    "minimum_active_exclusion_objects": 4,
    "requested_vehicle_checks": ["turning_radius", "swept_path", "reverse_distance"]
  }
}
