{
  "version": "0.1",
  "name": "phase0 large branch test sample",
  "units": "m",
  "standards": {
    "jurisdiction": "CN",
    "standard_profile": "custom",
    "strictness": "conservative",
    "notes": "Phase 0 records standard intent but does not claim legal compliance."
  },
  "site": {
    "boundary": {
      "type": "polygon",
      "points": [[0, 0], [86, 0], [86, 66], [0, 66]]
    },
    "obstacles": [
      {
        "id": "equipment-room",
        "type": "building",
        "geometry": {
          "type": "polygon",
          "points": [[72, 8], [80, 8], [80, 16], [72, 16]]
        },
        "clearance": 0.3
      }
    ],
    "reserved_areas": []
  },
  "site_features": [
    {
      "id": "column-a1",
      "type": "column",
      "geometry": {
        "type": "circle",
        "center": [72, 24],
        "radius": 0.35
      },
      "clearance": 0.3,
      "affects": ["vehicle_clearance", "door_clearance"]
    },
    {
      "id": "charger-demo",
      "type": "charging_post",
      "geometry": {
        "type": "rectangle",
        "origin": [14, 58],
        "width": 0.5,
        "height": 0.4,
        "rotation_degrees": 0
      },
      "clearance": 0.4,
      "affects": ["stall_access"]
    }
  ],
  "entrances": [
    {
      "id": "main-gate",
      "mode": "shared",
      "center": [43, 0],
      "width": 8.0,
      "heading_degrees": 90,
      "allowed_movements": ["enter", "exit"]
    }
  ],
  "pedestrian_and_emergency": {
    "pedestrian_routes": [
      {
        "id": "walkway-demo",
        "geometry": {
          "type": "polyline_buffer",
          "points": [[0, 60], [18, 64]],
          "width": 1.8
        },
        "priority": "future"
      }
    ],
    "fire_lanes": [],
    "emergency_access_required": false
  },
  "vehicles": {
    "design_vehicle": {
      "id": "passenger-car",
      "length": 4.8,
      "width": 1.9,
      "wheelbase": 2.8,
      "min_turning_radius": 5.5,
      "swept_path_margin": 0.3,
      "max_reverse_distance": 12.0
    }
  },
  "parking": {
    "stall_types": [
      {
        "id": "standard-90",
        "family": "perpendicular",
        "width": 2.5,
        "length": 5.3,
        "allowed_angles": [0, 15, 30, 45, 60, 75, 90],
        "drive_over": false,
        "access_sides": ["front"],
        "enabled": true
      },
      {
        "id": "ev-front-post",
        "family": "perpendicular",
        "width": 2.6,
        "length": 5.5,
        "allowed_angles": [90],
        "drive_over": false,
        "access_sides": ["front"],
        "blocked_sides": ["back"],
        "fixed_features": [
          {
            "type": "charging_post",
            "side": "back",
            "offset": 0.5,
            "clearance": 0.4
          }
        ],
        "enabled": false
      }
    ],
    "quotas": {
      "accessible_min": 0,
      "ev_min": 0
    }
  },
  "aisles": {
    "selection_mode": "fixed",
    "fixed_class": "wide-two-way-no-cross",
    "classes": [
      {
        "id": "wide-two-way-no-cross",
        "width": 6.0,
        "capacity": "two_vehicle",
        "directionality": "two_way",
        "centerline_crossing": "forbidden",
        "enabled": true
      },
      {
        "id": "narrow-one-way",
        "width": 3.5,
        "capacity": "single_vehicle",
        "directionality": "one_way",
        "centerline_crossing": "not_applicable",
        "enabled": false
      }
    ]
  },
  "constraints": {
    "setbacks": {
      "site_boundary": 0.2,
      "obstacle": 0.3
    },
    "circulation": {
      "require_all_stalls_reachable": true,
      "require_exit_path": true,
      "allow_dead_end_aisles": false,
      "allow_narrow_two_way": false
    },
    "maneuvering": {
      "require_turning_radius_check": true,
      "require_swept_path_check": false,
      "max_reverse_distance": 12.0
    }
  },
  "optimization": {
    "objective": "balanced",
    "heading_deltas_degrees": [0],
    "entrance_offsets": [0],
    "branch_start_positions": [24, 42, 60],
    "branch_sides": ["left"],
    "max_branches": 2,
    "enable_connectors": true,
    "connector_allow_outer_stall_row": true,
    "connector_inset_depths": [0.0, 2.65, 5.3, 7.95],
    "connector_throat_length": 3.0,
    "connector_allow_l_shape_end_stalls": true,
    "maneuver_l_shape_fallback": true,
    "promote_candidate_layout_preview": true,
    "branch_start_step": 2.5,
    "weights": {
      "stall_count": 100.0,
      "aisle_area": 0.0,
      "heading_delta": 0.0,
      "entrance_offset": 0.0,
      "branch_count": 0.0,
      "dead_end_length": -12.0
    }
  },
  "diagnostics": {
    "explain_rejections": true,
    "export_debug_layers": true,
    "include_unsupported_fields": true,
    "report_constraint_status": true
  },
  "metadata": {
    "author": "OpenParkCAD",
    "coordinate_system": "local meters",
    "notes": "Large Phase 0 sample sized to exercise branch, candidate-network, and candidate-layout previews."
  }
}
